{
  "task_mode": "new_blueprint_from_incomplete_idea",
  "conversation_language": "zh-CN",
  "user_goal": "Generate a standardized paper blueprint and analysis file.",
  "deepresearch_question_type": "general_blueprint_judgment",
  "user_idea_summary": "TBD",
  "known_information": {
    "field": "TBD",
    "subfield": "TBD",
    "target_venue_or_journal": "TBD",
    "paper_type": "TBD",
    "research_problem": "TBD",
    "method_or_approach": "TBD",
    "existing_evidence": "TBD",
    "available_data_or_artifacts": "TBD",
    "constraints": []
  },
  "existing_blueprint": null,
  "revision_request": null,
  "missing_information": [],
  "blueprint_sections_under_review": [],
  "deepresearch_questions": [],
  "required_source_types": [
    "papers",
    "code",
    "datasets",
    "benchmarks",
    "venue_guidelines"
  ],
  "codex_integration_instructions": [
    "Answer only the focused research question.",
    "Recommend blueprint decisions only for sections under review.",
    "Mark unsupported or uncertain items as TBD or needs_user_confirmation."
  ],
  "output_format": "deepresearch_report_schema"
}
